{
  "name": "echo-demo",
  "version": "0.0.1",
  "type": "bimcanvas-plugin",
  "schemaVersion": 1,
  "compatibility": { "bimcanvas": "^0.1.0" },
  "displayName": "Echo Demo Plugin",
  "description": "组3 手动联调最小 plugin: 注册一个回显工具 mcp__echo-demo__echo",
  "mcpTools": "mcp_tools/echo.py",
  "mcpNamespace": "echo-demo"
}
